{
 "schema_version": "handoff-work/1",
 "engagement_id": "f8-r3-fx02",
 "revision": 6,
 "profile": "handoff-v1",
 "route": "platform-constrained",
 "objective": "context.json#literal_request",
 "scope_refs": [
  "enquadramento.md"
 ],
 "authorization_refs": [],
 "last_integrated_operation": "publish-cfaa034702294a0f",
 "active_task": null,
 "tasks": [
  {
   "id": "TASK-001",
   "role": "analista-integrado",
   "state": "completed",
   "input_refs": [
    {
     "ref": "shared-understanding.md",
     "sha256": "63a415d73be5cdf944205c6f7966ff7739f70bacb4a997312a601d6fd5658eb3"
    },
    {
     "ref": "answers.md",
     "sha256": "4467ea70af4b42b3cf211b3a701083483bdd5ec80e45296f737bd51b1716372d"
    },
    {
     "ref": "enquadramento.md",
     "sha256": "93db00f6a8792d0c78f8505833ec5f27851a17a95b13690f77c58c151426dca9"
    }
   ],
   "dependencies": [],
   "blocker_refs": [],
   "completion_criteria": [
    "linhas das perspectivas as seis publicadas na SU para R-01"
   ],
   "output_refs": [
    "publish-980e7f78a460fbff"
   ]
  },
  {
   "id": "TASK-002",
   "role": "analista-integrado",
   "state": "completed",
   "input_refs": [
    {
     "ref": "shared-understanding.md",
     "sha256": "e5f2e5148f3ae1bba9f4482d47f261955b8cc3e13830fde3901daa10bc7fadff"
    },
    {
     "ref": "answers.md",
     "sha256": "4dd48d08924970fa2cd9fb0cb80379210be0a90fb99534be825f2566c80482c8"
    },
    {
     "ref": "enquadramento.md",
     "sha256": "93db00f6a8792d0c78f8505833ec5f27851a17a95b13690f77c58c151426dca9"
    }
   ],
   "dependencies": [],
   "blocker_refs": [],
   "completion_criteria": [
    "linhas das perspectivas as seis publicadas na SU para R-02"
   ],
   "output_refs": [
    "publish-cfaa034702294a0f"
   ]
  }
 ],
 "results": [
  {
   "id": "RES-001",
   "task_id": "TASK-001",
   "ref": "_drafts/DRAFT-21af014fe08f",
   "input_revision": "e613c4836fe93d0adf2590b56042560888a3c7cdcc0d69f4d119e7c64981c70d",
   "status": "integrated",
   "freshness": "current",
   "sha256": "99688c7e743dfa20f48a6dc3e9bc7f3eb1f3e6f07ef93456e729f6a659c79a11"
  },
  {
   "id": "RES-002",
   "task_id": "TASK-002",
   "ref": "_drafts/DRAFT-84e41c2e9b3b",
   "input_revision": "0c34633f62af02907382b4720ef43c483ab9afcd3d18e7690551b058c0dc275a",
   "status": "integrated",
   "freshness": "current",
   "sha256": "4f74a5c4ec9bf4e48409343116c7d817683f303c575f995fe00ec5b2960feb58"
  }
 ],
 "next_actions": []
}
